{
  "schemaVersion": "yellow-goal/repository-assessment/v1",
  "executiveJudgment": {
    "usefulness": "Minimal Python application with a clear src/ layout and a pytest test suite.",
    "functionality": "Package installs editable and the test suite runs; no build backend is declared.",
    "cohesion": "Single-package layout, low coupling.",
    "milestoneReadiness": "Ready for a small, additive packaging milestone."
  },
  "ratings": [
    {
      "area": "packaging reproducibility",
      "rating": "fragile",
      "evidenceRefs": ["ev-001"],
      "whatRaisesIt": "pyproject.toml has no [build-system] table"
    }
  ],
  "findings": [
    {
      "schemaVersion": "yellow-goal/finding/v1",
      "id": "F-001",
      "severity": "medium",
      "classification": "missing_evidence",
      "title": "No [build-system] table declared in pyproject.toml",
      "evidenceRefs": ["ev-001"],
      "affectedFiles": ["pyproject.toml"],
      "consequence": "Editable installs may behave inconsistently across pip versions without an explicit build backend.",
      "requiredBehavior": "pyproject.toml should declare a [build-system] table (e.g. setuptools) so packaging is reproducible.",
      "status": "open"
    }
  ],
  "evidenceGaps": ["CI workflow presence was not independently confirmed for this fixture."],
  "biggestConstraint": "No declared build backend makes packaging behavior implementation-defined."
}
