{
  "schemaVersion": "yellow-goal/repository-assessment/v1",
  "executiveJudgment": {
    "usefulness": "Small, focused Node plugin with a clear single responsibility.",
    "functionality": "Core export works; a real test script exists and is evidenced.",
    "cohesion": "Single-module layout, low coupling.",
    "milestoneReadiness": "Ready for a small, additive milestone."
  },
  "ratings": [
    {
      "area": "test coverage",
      "rating": "adequate",
      "evidenceRefs": ["ev-001"],
      "whatRaisesIt": "a real test script is present and evidenced"
    }
  ],
  "findings": [
    {
      "schemaVersion": "yellow-goal/finding/v1",
      "id": "F-001",
      "severity": "medium",
      "classification": "missing_evidence",
      "title": "No lint step is wired into the test script",
      "evidenceRefs": ["ev-001"],
      "affectedFiles": ["package.json"],
      "consequence": "Lint regressions can land without being caught.",
      "requiredBehavior": "The test script (or a sibling script) should run lint before or alongside tests.",
      "status": "open"
    }
  ],
  "evidenceGaps": ["CI workflow presence was not independently confirmed for this fixture."],
  "biggestConstraint": "No CI workflow evidence was collected for this fixture."
}
